{
  "summary": {
    "teamId": "team-demo",
    "appId": "app-demo",
    "usageEventCount": 12,
    "openAlertCount": 1,
    "openIncidentCount": 0,
    "pendingAssetReviewCount": 2,
    "webhookDeliveryCount": 4,
    "activeLegalRecordCount": 1,
    "generatedAt": "2026-07-09T00:00:00.000Z"
  },
  "teams": [],
  "members": [],
  "apps": [],
  "pendingAssetReviews": [],
  "openAlerts": [],
  "openIncidents": [],
  "failedWebhookDeliveries": [],
  "recentAuditLogs": [],
  "generatedAt": "2026-07-09T00:00:00.000Z"
}
